id,title,description,date_creation,location,latitude,longitude,company,url,contract_type,source
193JFDR,Agent / Agente de sécurité SSIAP 1 site Data Center (H/F),"Seris Security, recherche en CDI à temps complet un(e) agent(e) de sécurité incendie pour intégrer une équipe dynamique pour un site basé à Val de Reuil (27).
 
Sur un site data center en postes alternés jour/ nuit de 12h au statut Employé coefficient 140 (1912,24€ brut mensuel).
Horaires : 07h00 - 19h00 // 19h00 - 07h00 ou 06h00 - 18h00 // 18h00 - 06h00
 
Vos principales missions sont:  
- L'accueil et le contrôle d'accès du site,
- La protection et l'alerte en cas d'accident ou d'événement exceptionnel
- La surveillance générale du site,
- La sécurité technique et incendie de base,
- Le secours et l'assistance aux personnes,
- Vos interventions s'effectuent dans le strict respect des consignes et des procédures.


 
Professionnel de la sécurité.
Avec une Carte Professionnelle en cours de validité, ainsi qu'un SST, un SSIAP 1 et les habilitations électriques à jour serait un plus.
 
Les avantages Seris :
- Une agence attentive : possibilité d'aménagement de planning, demandes d'indisponibilités possibles, aide dans certaines de vos démarches.
 
- Des avantages sociaux:
o Paiement des salaires au 1er du mois,
o Primes de disponibilités pour pallier l'absence d'un collègue, primes paniers,   
o Cooptation: 150 € à la signature du contrat de la personne recommandée + 150 € à la validation de la période d'essai, 
 
- Des Centres de formations internes et reconnus avec des formateurs/trices SERIS qui maîtrisent le terrain.

Vous partagez nos valeurs et notre ambition, rejoignez-nous ?!
Nos prochaines étapes
Après un premier échange avec l'équipe recrutement, pour confirmer votre projet et vos attentes, vous rencontrerez l'équipe opérationnelle; ce sera l'occasion de découvrir votre futur lieu de travail et de faire connaissance avec le reste de l'équipe.
Chez SERIS, nous sommes convaincus que la diversité fait la richesse d'une entreprise. Nous étudions à compétences égales toutes les candidatures reçues.",2025-06-03T16:06:17.126Z,,49.261533,1.20933,SERIS,https://candidat.francetravail.fr/offres/recherche/detail/193JFDR,CDI,france_travail
193HZDV,Data Scientist H/F (H/F),"Qui sommes-nous ?
HIMYDATA, c'est une startup deeptech en pleine expansion, spécialisée dans la technologie digitale et l'intelligence artificielle.
Notre plateforme révolutionne le partage, le stockage et l'exploitation des données en entreprise grâce à une architecture orientée microservices. Une innovation made in France, prête à relever des défis internationaux. Toute l'équipe travaille en étroite collaboration (dev, produit, succès client, ventes) pour implémenter les meilleures fonctionnalités sur notre plateforme et proposer des solutions autour de la data dans un environnement propulsé par l'IA.

Nos valeurs :
Respect - Chacun-e a sa place et sa voix

Passion - L'innovation est notre moteur

Bienveillance - Une vraie équipe, pas juste des collègues

Envie de construire l'avenir du digital avec nous ?

Nous recherchons un-e Data Scientist, capable de porter un projet IA de bout en bout : depuis l'exploration des données jusqu'à la mise en production de modèles.
Tu travailleras à la fois sur des cas d'usage concrets, de l'intégration de LLMs (type GPT) à des projets de RAG, en passant par du machine learning plus classique et de l'analyse avancée.

Tes missions

Explorer, nettoyer, analyser des jeux de données variés
Concevoir et entraîner des modèles de Machine Learning / Deep Learning
Intégrer et adapter des modèles de LLM (GPT-like, open source...)
Mettre en place des pipelines RAG (Retrieval-Augmented Generation)
Industrialiser les modèles (via API, conteneurisation, CI/CD, monitoring)
Participer aux réflexions stratégiques IA / R&D
Documenter tes travaux, partager tes idées, apprendre et faire apprendre

Stack & outils

Langages : Python (pandas, scikit-learn, PyTorch / TensorFlow, LangChain, etc.)
MLOps / Infra : Docker, Git, MLflow, FastAPI, cloud (AWS/GCP/Azure)
LLM & RAG : OpenAI, HuggingFace, Transformers, vectordb (FAISS, Weaviate, etc.)
Data : SQL / NoSQL, outils d'analyse et de visualisation (Jupyter, Streamlit, etc.)

Profil recherché

3 à 5 ans d'expérience solide en data science dont une significative sur des LLM
À l'aise avec l'ensemble du cycle IA : analyse, modélisation, déploiement
Curieux-se, autonome, proactif-ve, et toujours en veille sur les nouveaux modèles
Capacité à expliquer ce que tu fais, que ce soit à un-e dev, un-e PO ou un-e client-e
À l'aise pour passer d'un prototype à une vraie API prête à être utilisée",2025-06-03T15:09:04.338Z,,43.627339,7.016557,HIMYDATA,https://candidat.francetravail.fr/offres/recherche/detail/193HZDV,CDI,france_travail
193HXSR,Chargé de l'Intégration des Produits - Pim & Data Management (H/F),"Rejoins l'aventure Dafy Moto en tant que Chargé(e) de l'Intégration des Produits !

Dafy Moto, leader dans le domaine de la moto et des équipements, recherche un(e) Chargé(e) de l'Intégration des Produits pour rejoindre son équipe e-commerce dynamique ! Si tu es passionné(e) par la gestion de données, l'optimisation des processus et que tu as un esprit rigoureux et curieux, ce poste est fait pour toi.

Tes missions :
- Gestion et intégration de produits : Tu seras responsable de l'intégration des produits dans notre PIM (Product Information Manager), incluant la création de références, EAN et les déclinaisons (tailles, couleurs...).
- Suivi et mise à jour des informations : Tu t'assures que toutes les données sont à jour, en contact direct avec nos fournisseurs et différents services internes pour résoudre les manques d'informations.
- Optimisation des processus : Tu optimises la catégorisation des produits, les filtres et participes à la gestion des erreurs, afin d'offrir une expérience client fluide et précise.
- Collaboration avec ton équipe : Tu remonteras les problématiques à ton responsable.


Le profil recherché :

Ce que nous recherchons chez toi :

Une excellente maîtrise d'Excel et des outils de gestion de données.

Un sens aigu du détail et de la rigueur.

Une bonne communication pour collaborer efficacement avec les fournisseurs et les services internes.

Une forte capacité d'adaptation et de réactivité face aux défis.

Temps de travail : 35 heures par semaine + 2.5 heures supplémentaires

Si tu as l'esprit d'équipe, un goût prononcé pour la gestion de données et que tu es à la recherche d'un poste évolutif dans un environnement passionnant, rejoins-nous chez Dafy Moto !",2025-06-03T14:45:24.863Z,,45.751398,3.08607,SA DAFY MOTO,https://candidat.francetravail.fr/offres/recherche/detail/193HXSR,CDD,france_travail
193HWBP,Data engineer (H/F),"À propos
Qui sommes-nous ?

Nous sommes passionnés par les nouvelles technologies, et vous ? 

Rejoindre Amiltone, c'est intégrer des équipes dynamiques et soudées dans le cadre de projets novateurs et ambitieux. Nous relevons les challenges techniques de nos clients et les accompagnons dans leur transformation digitale.

Pourquoi choisir Amiltone ? 

 Amiltone, plus qu'une entreprise, un état d'esprit !

Notre objectif ? Votre épanouissement professionnel !

Nous avons à cœur de :

Vous accompagner au mieux au travers d'un suivi personnalisé
Vous faire monter en compétences en vous proposant des formations tout au long de votre carrière
Comprendre vos besoins et respecter nos engagements
Vous proposer des missions de qualité avec des technologies innovantes
Cultiver votre potentiel grâce à notre programme de développement personnel Addvise


Votre bien-être passe aussi par des activités extraprofessionnelles, c'est pourquoi nous vous proposons des séances sportives animées par nos coachs, soirées pour se retrouver et animations (à l'agence ou en visio), Gaming nights...

Le poste
Vos missions ?

Intégré(e) à nos équipes ou chez nos clients, vous contribuez à développer et valoriser l'ensemble des données en résolvant des problématiques business concrètes via les technologies liées à la Data

A ce titre, vos missions seront les suivantes :

- Concevoir et mettre en place des architectures de données en choisissant les technologies adaptées aux besoins.
- Gestion des bases de données en garantissant la performance et la scalabilité des solutions de stockage.
- Analyser et explorer les données avec les différents outils.
- Mettre en place des tableaux de bord avec Power BI ou Tableau en exploitant les données transformées via Talend.
- Interagir avec les équipes métier pour comprendre et les besoins.
- Utiliser TALEND pour extraire des données depuis plusieurs sources (SQL, API, Excel ...).
- Automatiser les processus ETL pour centraliser les données dans un Data Wrehouse (Snowflake).
- Participation aux projets IA.


Compétences requises :

- ETL: Talend
- Analyse de données (PowerBI, Tableau)
- Base de données (SQL, GCP)
- Langages: Python, SQL



Profil recherché
Profil recherché
Alors ? Prêt à devenir Amiltonien ?

N'hésitez pas à postuler si vous vous reconnaissez :

- Diplômé d'un bac+3/+5 (Licence, école d'ingénieur ou master), vous avez 3 ans d'expérience en tant que Data Scientist/ Ingénieur.
- Vous aimez découvrir de nouveaux contextes fonctionnels et comprendre les objectifs des applications que vous développez.
- A l'aise dans une organisation agile, vous faites preuve de rigueur.

Outre vos compétences techniques, nous nous intéressons également à votre potentiel et votre motivation.

Nos postes sont ouverts aux personnes en situation de handicap.",2025-06-03T14:14:50.145Z,,50.637788,3.147967,AMILTONE,https://candidat.francetravail.fr/offres/recherche/detail/193HWBP,CDI,france_travail
193HKVH,Data engineer (H/F),"À propos
Qui sommes-nous ?

Nous sommes passionnés par les nouvelles technologies, et vous ? 

Rejoindre Amiltone, c'est intégrer des équipes dynamiques et soudées dans le cadre de projets novateurs et ambitieux. Nous relevons les challenges techniques de nos clients et les accompagnons dans leur transformation digitale.

Pourquoi choisir Amiltone ? 

 Amiltone, plus qu'une entreprise, un état d'esprit !

Notre objectif ? Votre épanouissement professionnel !

Nous avons à cœur de :

Vous accompagner au mieux au travers d'un suivi personnalisé
Vous faire monter en compétences en vous proposant des formations tout au long de votre carrière
Comprendre vos besoins et respecter nos engagements
Vous proposer des missions de qualité avec des technologies innovantes
Cultiver votre potentiel grâce à notre programme de développement personnel Addvise


Votre bien-être passe aussi par des activités extraprofessionnelles, c'est pourquoi nous vous proposons des séances sportives animées par nos coachs, soirées pour se retrouver et animations (à l'agence ou en visio), Gaming nights...

Le poste
Vos missions ?

Intégré(e) à nos équipes ou chez nos clients, vous contribuez à développer et valoriser l'ensemble des données en résolvant des problématiques business concrètes via les technologies liées à la Data

A ce titre, vos missions seront les suivantes :

- Concevoir et mettre en place des architectures de données en choisissant les technologies adaptées aux besoins.
- Gestion des bases de données en garantissant la performance et la scalabilité des solutions de stockage.
- Analyser et explorer les données avec les différents outils.
- Mettre en place des tableaux de bord avec Power BI ou Tableau en exploitant les données transformées via Talend.
- Interagir avec les équipes métier pour comprendre et les besoins.
- Utiliser TALEND pour extraire des données depuis plusieurs sources (SQL, API, Excel ...).
- Automatiser les processus ETL pour centraliser les données dans un Data Wrehouse (Snowflake).
- Participation aux projets IA.


Compétences requises :

- ETL: Talend
- Analyse de données (PowerBI, Tableau)
- Base de données (SQL, GCP)
- Langages: Python, SQL



Profil recherché
Profil recherché
Alors ? Prêt à devenir Amiltonien ?

N'hésitez pas à postuler si vous vous reconnaissez :

- Diplômé d'un bac+3/+5 (Licence, école d'ingénieur ou master), vous avez 3 ans d'expérience en tant que Data Scientist/ Ingénieur.
- Vous aimez découvrir de nouveaux contextes fonctionnels et comprendre les objectifs des applications que vous développez.
- A l'aise dans une organisation agile, vous faites preuve de rigueur.

Outre vos compétences techniques, nous nous intéressons également à votre potentiel et votre motivation.

Nos postes sont ouverts aux personnes en situation de handicap.",2025-06-03T10:51:59.171Z,,50.637788,3.147967,AMILTONE,https://candidat.francetravail.fr/offres/recherche/detail/193HKVH,CDI,france_travail
193HGLV,CRM & Data System Specialist (H/F),"Rejoindre EVBox, c'est intégrer une entreprise internationale portée par des valeurs fortes : innovation, responsabilité environnementale, inclusion et excellence opérationnelle. Nous offrons un environnement de travail dynamique, collaboratif et ouvert où chaque talent peut faire la différence.

À propos de l'équipe

Migration et maintenance CRM : Participer à la mise en œuvre d'un nouveau système CRM, y compris la configuration et la maintenance des structures et des flux de données, ainsi que la migration des données du CRM actuel vers le nouveau.
Maintenance des systèmes de reporting : Superviser la maintenance des systèmes de reporting des interventions (Jotform).
Analyse de la satisfaction client : Analyser la satisfaction client et maintenir le système de collecte des données de satisfaction client.
Analyse des données : Effectuer l'analyse des données et s'assurer de la mise à jour du CRM et des autres données. Automatiser les rapports d'indicateurs clés de performance pour la prise de décision.
Maintenance du parc installé : Maintenir le parc installé de stations (création et mise à jour)

À propos de vous

Licence ou MBA en informatique, Data ou domaine similaire
Au moins 3 ans d'expérience sont requis en gestion de la relation client (CRM), en analyse de données ou dans un domaine similaire.

Expérience, compétences et aptitudes requises

Expérience avérée en implémentation et maintenance de CRM.
Solides compétences analytiques et expérience en analyse de données.
Maîtrise de Power Automate et Power BI ou d'outils similaires.
Capacité à travailler en autonomie.
Excellentes capacités d'organisation et de multitâche.
Excellentes compétences en communication et aptitude à travailler en équipe.
Parler parfaitement l'anglais et le français est indispensable.

SOFTSKILLS
Excellentes compétences interpersonnelles, communicationnelles et collaboratives.
Esprit d'analyse et de synthèse
Sens de l'organisation et autonomie
Gestion du temps",2025-06-03T10:09:04.272Z,,44.760587,-0.654768,EVBOX,https://candidat.francetravail.fr/offres/recherche/detail/193HGLV,CDI,france_travail
193GYXN,BPO Lead Master Data Gouvernance (f/h) (H/F),"Pourquoi a-t-on besoin de vous ?
Le/La BPO Lead Master Data, au sein de léquipe OXYGEN France, pilote et anime avec son équipe et léquipe projet lintégralité des master data autour de limplémentation de S/4 Hana et des applications annexes dans tous les Systèmes et Applications du scope OXYGEN.

 Responsabilités et missions :

Animation & Management

Manage son équipe de Master Data et anime lactivité de léquipe projet, dont il/elle a la charge, ainsi que la communauté de « correspondant » dans les business en charge de la donnée (lanimation de la data quality et des campagnes de nettoyage)
Assure les différentes étapes du projet avec la core team dans le respect des délais.
Est le garant et responsable de la définition de la MDM pour la France
Travaille avec les architectes techniques, les concepteurs d'applications, le BPO et les SME pour comprendre pleinement les exigences de conversion des données et pour concevoir les procédures et les applications de conversion.
Collabore avec les architectes et les concepteurs de la solution d'intégration pour concevoir la solution d'intégration. Sassurer de lalignement des données entre MDM/CRM/S4 et entre PIM/S4/MES
Collabore avec les BPO, les utilisateurs clés, le responsable de lintégration et de la migration des données pour définir les exigences et la structure des données de tous les systèmes applicatifs et pour définir le mapping entre les systèmes actuels et S4 Hana
Assure que les conceptions de base de données répondent aux exigences, y compris le volume de données.
Interface

Il/Elle est linterlocuteur(trice) pour les questions SAP et la TAM pour le cluster France
Travaille en étroite collaboration avec les équipes en charge de la migration des données
Examine les exigences et la qualité des données
Identifie et communique tout problème qui pourrait affecter d'autres secteurs du projet.
Sassure de la Gestion des masters datas

Il/Elle coordonne avec son équipe de Master Data dédié au projet les sujets liés à la data autour des produits, et autour des business partners
Coordonne le maintien de bases de données propres
Coordonne le nettoyage des données (Élimination des doublons, des clients/ fournisseurs/contrats obsolètes)
Supervise la cohérence des fichiers (contrats avec RSA, condition de paiements cohérentes, type de prix adapté)
Supervise la création de nouveaux clients/ fournisseurs (unicité, jeu de données complets, exactitude des informations)
 

Ce poste est-il fait pour vous ?
Vous êtes titulaire dun Bac +3 minimum et justifiez dune solide expérience en gestion de projet.

Vous savez analyser les besoins métiers et les traduire en solutions fonctionnelles et/ou techniques concrètes.

Une bonne connaissance de lenvironnement SAP est indispensable : sans être expert en configuration ou développement, vous comprenez comment les fonctionnalités peuvent être prises en charge par la solution.

Vous êtes à laise pour collaborer avec des équipes techniques et contribuer à la conception détaillée.

La maîtrise de langlais à loral comme à lécrit est requise.

Rigueur, méthode et sens de la pédagogie sont des atouts essentiels pour réussir sur ce poste. Vous faites preuve dautonomie tout en appréciant le travail en équipe et en réseau. Votre capacité à prendre du recul et à proposer des pistes damélioration des processus sera également fortement valorisée.

Saint-Gobain valorise légalité des chances et encourage toutes les candidatures, quel que soit le genre, lâge, lorigine, le handicap ou le parcours.",2025-06-03T07:54:36.819Z,,48.897974,2.257057,COMPAGNIE DE SAINT-GOBAIN,https://candidat.francetravail.fr/offres/recherche/detail/193GYXN,CDI,france_travail
193GVRZ,Data Analyste Power BI (H/F),"Vous êtes data analyste Power BI, vous faites la modélisation et la mise à jour régulière de bases de données entreprise, vous sélectionner des sources de données pertinentes, assurer la qualité des données, faites l'extraction et la traduction des données business en données statistiques, proposer des améliorations pour les bases de données, analyser les données pour en tirer des informations exploitables, produire des analyses métiers et recommandations, créer des dashboards et mettez en place des KPIs pour le reporting des performances. Nous serons heureux de vous intégrer dans notre société.
En outre, vous assurerez également la diffusion des rapports d'analyse résultant du BI & web analytics et reste à l'affût des nouveaux outils pour améliorer l'analyse des données.",2025-06-02T18:40:06.350Z,,4.925248,-52.311583,GSET CONSULTING,https://candidat.francetravail.fr/offres/recherche/detail/193GVRZ,CDI,france_travail
193GSTQ,Alternance - Data Engineer (H/F),"Notre équipe Data recherche un(e) alternant(e) motivé(e) et passionné(e) pour participer à son projet data. Etant au début de son projet, cela offre l'opportunité de co-construire des solutions !

En tant que Data Engineer en alternance, tu participeras à la migration de notre Data Warehouse existant vers le Cloud (Snowflake) et alimentera nos nouveaux jeux de données.

Tes missions principales :
- Structurer et documenter nos chaînes de données dans notre datacatalogue OpenMetadata
- Améliorer notre chaîne d'historisation en convertissant des jobs talend en script SQL
- Participer à la refonte de nos processus d'alimentation en appliquant de nouvelles règles

Tu es :
- En formation Bac +3 à Bac +5 dans le domaine de la data ou de l'informatique
- Curieux, force de proposition, dynamique et autonome.
- À l'aise avec les bases de données et le langage SQL

Ce que nous t'offrons :
Intégrer notre équipe, c'est rejoindre un groupe dynamique et innovant avec des outils à la pointe comme Snowflake, OpenMetadata et QlikCloud.

Avantages :
- Tickets restaurants
- Plan d'épargne retraite obligatoire (PERO)
- CSE
- Mutuelle à tarif unique
- Partenariats sportifs (Rugby, Handball)
- Convivialité et bienveillance
- Prime d'assiduité
- Prime de participation",2025-06-02T17:02:19.386Z,,47.395476,0.69472,APIVIA COURTAGE,https://candidat.francetravail.fr/offres/recherche/detail/193GSTQ,CDD,france_travail
193GPSK,Ingénieur.e travaux Data Center (H/F),"Fondé en 1983, APL est le 1er cabinet de conseil et d'ingénierie spécialisé dans la conception et la réalisation de data centers en France.

Nos expertises s'articulent autour de 4 pôles : conseil et ingénierie data center, conseil et ingénierie IT, maintenance et exploitation, numérique responsable.

APL se distingue sur son marché par son positionnement en faveur d'un numérique durable. Notre mission d'entreprise « Organic Design » vise à concevoir, pour nos clients, des data centers évolutifs, en symbiose avec leur environnement.

Notre siège social est basé à Montrouge (92) et, de par, nos projets, nous sommes présents dans différents points en France (Lyon, Marseille, Bordeaux, Toulouse, Rennes etc.) ainsi qu'à l'international (Suisse et Italie).

En 2024, APL Data Center a passé le seuil des 200 salariés et offre à ses collaborateurs un environnement de travail agréable avec de nombreux avantages (travail hybride avec le télétravail, mutuelle prise en charge à 100%, tickets restaurant, learning By APL, prise en charge d'une partie de l'abonnement sportif, parental challenge, avantages CSE, etc.).

Rejoindre APL Data Center c'est :

S'intégrer dans un groupe en pleine expansion en France et à l'International, porté par des valeurs fortes et partagées ;
Faire partie d'équipes d'experts, toujours orientées vers l'excellence et l'innovation ;
Évoluer dans un secteur dynamique et en pleine mutation, avec des défis passionnants à relever ;
Œuvrer en synergie avec des équipes engagées et passionnées
Descriptif du poste

Ingénieur.e, responsable et autonome, vous aimez le terrain, le contact et vous souhaitez réaliser des bâtiments à haute valeur ajoutée technologique.
Dans le cadre de nos réalisations d'ouvrages Data Centers, vous pilotez et coordonnez un ou des chantiers d'envergure en tout corps d'état sous la responsabilité du chef de projet.

Vous assurez :

Le pilotage des chantiers qui vous sont confiés : gestion, planification et organisation des différentes phases des travaux TCE (gros œuvre, second œuvre, lots techniques).
Les missions OPC (Organisation, Pilotage et Coordination), DET / MO exécution et la mission AOR (Assistance aux Opérations de Réception).
Vous participez en amont aux missions ACT (Assistance à la Consultation et au Jugement des Offres des entreprises de travaux).
Vous développez un relationnel de qualité avec l'ensemble des prenantes du projet.

La durée de nos projets oscille entre 3 mois et 18 mois. Ils comportent une très forte valeur ajoutée technique (climatisation, courants forts et courants faibles notamment).
En fonction de vos compétences et de votre évolution, vous pourrez être amené(e) à participer à l'élaboration des offres et à la conception des installations.



Profil recherché

La haute technicité de nos réalisations Data Centers (bâtiment de type industriel) requiert une formation d'Ingénieur/e généraliste (dominante climatique et/ou électrique).

Vous justifiez idéalement d'une première expérience réussie en planification et conduite de travaux TCE, de préférence sur des chantiers très techniques et/ou industriels.

Vous êtes rigoureux, organisé et faites preuve d'un très bon rédactionnel.

Vous maîtrisez la suite office et MS Project.

La maîtrise de la langue anglaise est un plus.

Enfin, vos qualités managériales et relationnelles sont essentielles à ce poste car il s'agit d'un travail d'équipe au service de nos clients.

Mobilité requise avec des déplacements sur les réalisations en France.",2025-06-02T16:05:48.676Z,,48.815929,2.316207,APL DATA CENTER,https://candidat.francetravail.fr/offres/recherche/detail/193GPSK,CDI,france_travail
