id,title,description,date_creation,location,latitude,longitude,company,url,contract_type,source
5265683783,Data engineer,"Proxiad Ouest est à la recherche d’un nouveau talent pour compléter son équipe ! Qui sommes-nous ? Avec une écoute attentive et un suivi régulier de ses collaborateurs, une bonne ambiance et des petits déjeuner à la clé, Proxiad est une ESN qui porte une attention toute particulière au bien-être de ses collaborateurs. Spécialisé dans le Conseil et l’Expertise auprès de ses clients, le groupe Proxiad compte aujourd’hui plus de 1000 collaborateurs en France. Intervenant dans différents secteurs d…",2025-06-24T15:16:55Z,"Seine-Maritime, Normandie - France > Normandie > Seine-Maritime",49.629473,0.78306,PROXIAD,https://www.adzuna.fr/details/5265683783?utm_medium=api&utm_source=df7b4409,CDI,adzuna
5265683242,Data engineer,"Qui sommes-nous ? Worldline aide les entreprises de toutes formes et tailles à accélérer leur parcours de croissance - rapidement, simplement et en toute sécurité. Nous sommes les innovateurs au cœur de l'industrie de la technologie des paiements, façonnant la manière dont le monde paye et est payé. Notre technologie alimente la croissance de millions d'entreprises sur 5 continents. Et tout comme nous aidons nos clients à accélérer leur activité, nous nous engageons à aider nos collaborateurs à…",2025-06-24T15:16:53Z,"Seine-Maritime, Normandie - France > Normandie > Seine-Maritime",49.629473,0.78306,Worldline,https://www.adzuna.fr/details/5265683242?utm_medium=api&utm_source=df7b4409,CDI,adzuna
5265683365,Data engineer,"Qui sommes-nous ? Worldline aide les entreprises de toutes formes et tailles à accélérer leur parcours de croissance - rapidement, simplement et en toute sécurité. Nous sommes les innovateurs au cœur de l'industrie de la technologie des paiements, façonnant la manière dont le monde paye et est payé. Notre technologie alimente la croissance de millions d'entreprises sur 5 continents. Et tout comme nous aidons nos clients à accélérer leur activité, nous nous engageons à aider nos collaborateurs à…",2025-06-24T15:16:53Z,"Seine-Maritime, Normandie - France > Normandie > Seine-Maritime",49.629473,0.78306,Worldline,https://www.adzuna.fr/details/5265683365?utm_medium=api&utm_source=df7b4409,CDI,adzuna
5263608492,Data Engineer Spark - Scala - Projet Datalake H/F,"Contexte de la mission : Dans le cadre de la modernisation de ses systèmes de gestion et d'analyse de données, notre client, basé à Lyon, renforce ses équipes techniques en intégrant un Data Engineer. Ce renfort participera à un projet stratégique de mise en place et d'évolution de flux de données au sein d'un environnement Cloud structuré autour d'un Datalake. Le client travaille dans un environnement agile et multiculturel, avec une équipe majoritairement francophone mais comprenant également…",2025-06-23T08:21:40Z,"Rhône, Auvergne-Rhône-Alpes - France > Auvergne-Rhône-Alpes > Rhône",45.85511,4.902705,Viveris.,https://www.adzuna.fr/land/ad/5263608492?se=RPdSjxdR8BGIuJxkgtkhcg&utm_medium=api&utm_source=df7b4409&v=C802D41C9A3A7FD27056236245A0D51298140940,,adzuna
5265080421,Chef de Projets Data - Environnement Agile et Performance Qualitative - Reims H/F,"Envie de donner du sens à vos compétences ? Nous sommes là pour permettre au plus grand nombre de construire leur vie en confiance. Notre Groupe écrit l'aventure du mutualisme depuis plus de 120 ans et accompagne des hommes et femmes engagés pour leur territoire. Notre raison d'être fait écho en toi ? Rejoignez-nous et venez écrire votre belle histoire à nos côtés ! Assureur responsable et de proximité, nous accompagnons nos sociétaires Groupama Nord-Est c'est 1200 collaborateurs engagés au ser…",2025-06-24T07:29:54Z,"Reims 1er Canton, Reims - France > Grand-Est > Marne > Reims > Reims 1er Canton",49.2566,4.03309,Groupama Nord Est,https://www.adzuna.fr/land/ad/5265080421?se=RPdSjxdR8BGIuJxkgtkhcg&utm_medium=api&utm_source=df7b4409&v=FF5EBEB2B503AD3BCE9889E41E3152F5F43AAD6E,,adzuna
5263591791,Alternance - Assistant Master Data & Innovation IT H/F,"Alternance de 24 à 36 mois à partir de septembre Localisation : Pierre Bénite (69) Contexte La Holding Textile Hermès (HTH) coordonne les différentes unités de production textile au service du groupe Hermes et des marchés externes, depuis le tissage jusqu'à la confection et l'expédition des produits, tout en développant des synergies industrielles et humaines. Cette filière Textile est composée de 8 sociétés basées majoritairement en région Rhône Alpes. HTH mène depuis 2 ans un projet d'envergu…",2025-06-23T08:06:47Z,"Neuilly-en-Thelle, Senlis - France > Hauts-De-France > Oise > Senlis > Neuilly-en-Thelle",49.3536,2.22637,Holding Textile Hermes,https://www.adzuna.fr/land/ad/5263591791?se=LrtOkBdR8BGs389x6j9k3w&utm_medium=api&utm_source=df7b4409&v=B7C6489A999AB3812A3481FB96E1FF8AF19219F6,,adzuna
5264946115,Data Analyst Finance H/F (CDI),"Poste : En tant que Data Analyst Finance, vous contribuez au pilotage des activités de l'entreprise en fournissant des analyses pertinentes et des tableaux de bord aux différentes directions. Vous mettez en place des outils d'analyse avancés et contribuez à la digitalisation et l'automatisation des processus d'aide à la décision : * Collecter et analyser les données financières (P&L, bilans, flux de trésorerie) et opérationnelles, * Participer à la réalisation des budgets et des prévisions fina…",2025-06-24T04:49:03Z,France - France,,,Michael Page,https://www.adzuna.fr/land/ad/5264946115?se=LrtOkBdR8BGs389x6j9k3w&utm_medium=api&utm_source=df7b4409&v=D65A5B622310BBFEEBD0BDAA83A8ED362C68173A,CDI,adzuna
5265154654,Data Scientist IA - Développeur Machine Learning H/F,"Au coeur de la stratégie de modernisation de LCL, l'équipe IA est aujourd'hui reconnue au sein de la Direction des Systèmes d'Information. Après plusieurs années de succès dans le développement de cas d'usage à forte valeur ajoutée pour les métiers, nous entrons dans une phase d'accélération. Vous intégrerez une équipe qui développe et déploie des solutions à la fois innovantes et à la pointe de la recherche scientifique. L'équipe possède des compétences en traitement d'image et en traitement d…",2025-06-24T08:18:29Z,"Villejuif, L'Haÿ-les-Roses - France > Ile-de-France > Val-de-Marne > L'Haÿ-les-Roses > Villejuif",48.79507,2.36653,LCL - Fonctions Centrales,https://www.adzuna.fr/land/ad/5265154654?se=LrtOkBdR8BGs389x6j9k3w&utm_medium=api&utm_source=df7b4409&v=0728B4678115EF4B04FF67C2E784FB96BBADD6C9,,adzuna
5265169978,Data Engineering - Data Analyst Alternance H/F,"Au sein du département CDO de PwC France & Maghreb, l'Alternant sera rattaché à l'équipe Data Analytics & Insights (2 Data Engineers  3 Data Analysts) sous la supervision de M.ArnaudMARTIN. Ce que vous pouvez attendre de nous : Les missions qui lui seront confiées seront centrées sur : (i) le contrôle de la Qualité de Données : - Implémentation de contrôles (DQS) via procstocks SQL - Animation d'ateliers pour préciser les règles de contrôles - Documentation des travaux (ii) Data Engineering : -…",2025-06-24T08:34:43Z,"Neuilly-sur-Seine, Nanterre - France > Ile-de-France > Hauts-de-Seine > Nanterre > Neuilly-sur-Seine",48.88357,2.27251,PwC,https://www.adzuna.fr/details/5265169978?utm_medium=api&utm_source=df7b4409,,adzuna
5265089198,Alternance - Data Engineer - Data & IA H/F,"HETIC recherche pour une entreprise partenaire un(e) Data engineer en alternance afin technique et participer à la construction d'architectures de données performantes Les missions : Concevoir, développer et optimiser des pipelines de données Manipuler et analyser des datasets volumineux avec Python et ses framework Gérer, structurer et stocker les données via SQL et NoSQL Implémenter des algorithmes statistiques pour l'optimisation des processus data Visualiser et interpréter les données à l'a…",2025-06-24T07:37:24Z,"Montreuil, Bobigny - France > Ile-de-France > Seine-Saint-Denis > Bobigny > Montreuil",48.85826,2.43684,HETIC,https://www.adzuna.fr/details/5265089198?utm_medium=api&utm_source=df7b4409,,adzuna
5263777268,Data Engineer - B,"Description Vous serez intégré au sein de notre Service Line Data Value et vous interviendrez sur les différentes phases d'un projet BI/Big Data: •Acquisition des données •Stockage optimisé •Traitements et analyses •Mise en forme et développement de rapports/dashboards Vous proposerez des nouvelles lectures de données via un travail de fouille sur les gisements d’information, notamment client. Dans votre quotidien, vous contribuerez au partage et à la capitalisation des savoirs et des pratiques…",2025-06-23T12:46:10Z,"Allauch, Marseille - France > Provence-Alpes-Côte d'Azur > Bouches-du-Rhône > Marseille > Allauch",43.29834,5.38322,Forums Talents Handicap,https://www.adzuna.fr/details/5263777268?utm_medium=api&utm_source=df7b4409,CDI,adzuna
5264762924,Data Analytics Engineer,Ingénieur en Analyse de Données – Poste basé à Paris Ingénieur en analyse de données (un ingénieur data spécialisé dans le domaine de l'analytique) disposant des compétences suivantes : Compétences professionnelles clés Infrastructure et gestion des données (5 années d'expérience) Expérience dans la conception et la maintenance de pipelines de données (ETL/ELT) Maîtrise des plateformes cloud (ex. : AWS) et des outils comme Snowflake Bonne connaissance des architectures de data lake et data ware…,2025-06-24T01:17:17Z,"Paris, Ile-de-France - France > Ile-de-France > Paris",48.863839,2.344631,DGTL Performance,https://www.adzuna.fr/details/5264762924?utm_medium=api&utm_source=df7b4409,CDI,adzuna
5265683720,Architecte big data,"Rejoignez SQLI et faites partie de l'équipe Data, au sein d’une société à taille humaine, mais avec de grandes ambitions. Nous sommes plus de 2200 talents sur 13 pays et 3 continents. Un poste d'Architecte Data (H/F) est ouvert à PARIS (ou ROUEN selon votre localisation), pour faire partie des leaders de l'équipe Data chez SQLI et vous investir dans un environnement technique innovant. Vos missions : Piloter techniquement l'équipe de développement, être garant technique sur les engagements, vei…",2025-06-24T15:16:55Z,"Paris, Ile-de-France - France > Ile-de-France > Paris",48.863839,2.344631,SQLI,https://www.adzuna.fr/details/5265683720?utm_medium=api&utm_source=df7b4409,CDI,adzuna
5265682877,Architecte big data,"Capgemini Choisir Capgemini, c'est choisir une entreprise où vous serez en mesure de façonner votre carrière selon vos aspirations, où vous serez soutenu et inspiré par une communauté d’experts dans le monde entier, où vous pourrez réécrire votre futur. Rejoignez-nous pour redéfinir les limites de ce qui est possible, contribuer à libérer la valeur de la technologie pour les plus grandes organisations et participez à la construction d’un monde plus durable et inclusif. Nous recherchons actuelle…",2025-06-24T15:16:51Z,"Hauts-de-Seine, Ile-de-France - France > Ile-de-France > Hauts-de-Seine",48.82583,2.245857,Capgemini,https://www.adzuna.fr/details/5265682877?utm_medium=api&utm_source=df7b4409,CDI,adzuna
5265683343,Big data engineer,"L’ambition d’Orange Business est de devenir l’intégrateur réseau et numérique de référence en Europe, en nous appuyant sur nos forces autour des solutions de connectivité nouvelle génération, du cloud et de la cybersécurité. Nos 30 000 femmes et hommes présents dans 65 pays, dont chaque voix compte, sont tous animés par la même détermination et le même esprit d’équipe, pour construire les solutions digitales d’aujourd’hui et de demain et créer un impact positif pour nos clients, pour leurs sala…",2025-06-24T15:16:53Z,"Nord, Hauts-De-France - France > Hauts-De-France > Nord",50.447027,3.171878,Orange Business,https://www.adzuna.fr/details/5265683343?utm_medium=api&utm_source=df7b4409,CDI,adzuna
5264014500,RAF & Data bilingue,"Vous piloterez l'ensemble des fonctions administratives, financières et opérationnelles avec un focus sur la précision, l'efficacité et l'accompagnement de notre développement rapide. Vous collaborerez étroitement avec la direction afin de concevoir des outils de reporting stratégiques couvrant l'e-commerce, les ventes, la production et la supply chain. Responsabilités principales : -Concevoir et piloter la structure de reporting financier (P&L, bilans, prévisions de trésorerie) -Mettre en plac…",2025-06-23T17:48:31Z,"Paris, Ile-de-France - France > Ile-de-France > Paris",48.863839,2.344631,FED FINANCE,https://www.adzuna.fr/details/5264014500?utm_medium=api&utm_source=df7b4409,CDI,adzuna
5263965896,RAF & Data bilingue,"Fed Finance, cabinet spécialisé recherche pour l'un de ses clients dans le secteur de la mode de luxe, un RAF & Data bilingue F/H en CDI à Paris 17e. Vous piloterez l'ensemble des fonctions administratives, financières et opérationnelles avec un focus sur la précision, l'efficacité et l'accompagnement de notre développement rapide. Vous collaborerez étroitement avec la direction afin de concevoir des outils de reporting stratégiques couvrant l'e-commerce, les ventes, la production et la supply …",2025-06-23T16:17:52Z,"Paris, Ile-de-France - France > Ile-de-France > Paris",48.863839,2.344631,Fed Group,https://www.adzuna.fr/details/5263965896?utm_medium=api&utm_source=df7b4409,CDI,adzuna
5264627789,Alternance Data documentaliste,"A la croisée de deux univers, la santé et les nouvelles technologies, IQVIA est l’expert des données de santé depuis plus de 60 ans et dans 140 pays. IQVIA s’appuie sur ses bases de données uniques, sur son expertise et sur ses outils d’analyse pour apporter des services et des solutions de conseil aux acteurs du système de santé. Grace à l’utilisation de méthodes innovantes telles que l’intelligence artificielle, IQVIA contribue à l’amélioration de la prise en charge des patients et au dévelop…",2025-06-23T22:57:25Z,"Paris, Ile-de-France - France > Ile-de-France > Paris",48.863839,2.344631,FR12,https://www.adzuna.fr/details/5264627789?utm_medium=api&utm_source=df7b4409,,adzuna
5265156068,Data scientist Data et transformation numérique F/H,"Finalité du poste Il contribue à l'amélioration continue de l'exploitation des données, afin de renforcer l'aide à la décision, l'efficacité des actions de régulation, et la surveillance des situations à risque dans le domaine du médicament et des produits de santé. Il développe, adapte et maintient des outils d'analyse, de visualisation et de modélisation en lien avec les besoins métiers et les enjeux de santé publique. Son expertise permet de valoriser les données issues de sources variées, d…",2025-06-24T08:19:08Z,France - France,,,Agence nationale de sécurité du médicament et des,https://www.adzuna.fr/details/5265156068?utm_medium=api&utm_source=df7b4409,CDD,adzuna
5265565720,Business analyst Data quality IT h/f (Indépendant / Freelance),"Poste : Pour l'un de nos clients du secteur bancaire, nous recherchons un Business analyst Data quality IT qui accompagnera l'équipe DSI Risques. Compétences INDISPENSABLES attendues : Fonctionnel : Business analyst qui a déjà travaillé sur la Data Quality Métier : expérience avérée autour des data en capital markets Anglais : obligatoire Profil : Démarrage idéalement le : 23/06/2025 12 mois Temps plein (5 jours / semaine) Télétravail aménageable à discuter lors des entretiens Secteur : Banque …",2025-06-24T12:54:49Z,France - France,,,Mon Consultant Indépendant,https://www.adzuna.fr/land/ad/5265565720?se=LrtOkBdR8BGs389x6j9k3w&utm_medium=api&utm_source=df7b4409&v=FFFE087CB573E1155D5CCD7B04057D4770DDA015,CDD,adzuna
5265565722,Business analyst Data manager IT h/f (Indépendant / Freelance),"Poste : Pour l'un de nos clients du secteur bancaire, nous recherchons un Business analyst Data manager IT qui accompagnera les équipes Cash financing & risques. Compétences projet : Gestion de projet & coordination : Participation à la maintenance évolutive Rédaction des spécifications fonctionnelles Préparation des données Conduite du changement Suivi de la production Compétences INDISPENSABLES attendues : Métier : Expérience data au sein d'équipes Risque de crédit Fonctionnel : Data lake Had…",2025-06-24T12:54:49Z,France - France,,,Mon Consultant Indépendant,https://www.adzuna.fr/land/ad/5265565722?se=LrtOkBdR8BGs389x6j9k3w&utm_medium=api&utm_source=df7b4409&v=DC22DD3D12D6733EFAD547CCAD621DA944E39031,CDD,adzuna
5265565671,Architecte Data / Modélisation SI F/H (CDI),"Poste : Rejoignez une équipe de collaborateurs rattachés à la Direction ""Stratégie SI Architecture et Cloud"" de Covéa. Votre mission ? Porter et participer à la construction des solutions mises en oeuvre au sein des projets du groupe COVEA, sur l'ensemble de nos marques et métiers, en cohérence avec leur trajectoire de transformation (schéma directeur SI). Et concrètement ? Réaliser les études d'architecture pour les projets, animer les ateliers de réflexion sur les plans fonctionnels, applicat…",2025-06-24T12:54:30Z,France - France,,,Covea,https://www.adzuna.fr/land/ad/5265565671?se=LrtOkBdR8BGs389x6j9k3w&utm_medium=api&utm_source=df7b4409&v=025471D237E3FF18C23FF5A14DDD9DBDFEC190B1,CDI,adzuna
5265154184,Lead Data F/H,Le poste Vos missions ? En tant que Lead Data vous serez en charge des missions suivantes: - Accompagner et faire monter en compétence les membres de l'équipe Data - Définir la vision et la roadmap data de l'entreprsie - Compréhension du besoin client et être capable de le traduire aux équipes métier - Veiller à la cohérence et la qualité des données utilisées - Suivi de l'évolution des outils data - Développer des algorythmes et des modèles Machine Learning - Mettre en production des solutions…,2025-06-24T08:18:07Z,"Lyon, Rhône - France > Auvergne-Rhône-Alpes > Rhône > Lyon",45.72035,5.08666,Data New Road,https://www.adzuna.fr/details/5265154184?utm_medium=api&utm_source=df7b4409,CDI,adzuna
5265687470,Data Solution Architect (IT),"? Compétences fonctionnelles et stratégiques :Très bonne compréhension des enjeux liés à la data stratégie dans une grande organisation (idéalement en banque ou finance). Expérience en analyse des besoins métier et en syndication avec les parties prenantes. Capacité à jouer un rôle de Product Owner data ou de Business Analyst senior avec une forte dimension stratégique et technique. ?? Compétences techniques :Solide expérience dans le design d?architectures data (data factory, data lake, entrep…",2025-06-24T15:17:16Z,"Paris, Ile-de-France - France > Ile-de-France > Paris",48.863839,2.344631,PARTECK INGENIERIE,https://www.adzuna.fr/details/5265687470?utm_medium=api&utm_source=df7b4409,CDD,adzuna
5264369926,Ingénieur DATA H/F,"Contexte : Nous recherchons un/une Ingénieur Data pour assurer la collecte, la transformation et le stockage de données pour notre usine de Billy Berclau Douvrin. Missions principales : * Analyser et organiser les données brutes * Construire des systèmes de données et les pipelines * Mettre en place le monitoring de ces flux et les plans de recovery * Évaluer les besoins et les objectifs de l'entreprise en matière de traitement de données * Réaliser des rapports sur les pipelines de données et …",2025-06-23T20:30:08Z,"Douvrin, Béthune - France > Hauts-De-France > Pas-de-Calais > Béthune > Douvrin",50.51178,2.78694,AUTOMOTIVE CELLS COMPANY SE,https://www.adzuna.fr/details/5264369926?utm_medium=api&utm_source=df7b4409,CDD,adzuna
5265164708,Data Analyst - a H/F,"Description Vous serez intégré au sein de notre Service Line Data Value et vous interviendrez sur les différentes phases d'un projet BI/Big Data : * Acquisition des données * Stockage optimisé * Traitements et analyses * Mise en forme et développement de rapports/dashboards Vous proposerez des nouvelles lectures de données via un travail de fouille sur les gisements d'information, notamment client. Dans votre quotidien, vous contribuerez au partage et à la capitalisation des savoirs et des prat…",2025-06-24T08:27:50Z,"Aix en Provence Sud-Ouest, Aix-en-Provence - France > Provence-Alpes-Côte d'Azur > Bouches-du-Rhône > Aix-en-Provence > Aix en Provence Sud-Ouest",43.52491,5.45414,Capgemini Shared Services,https://www.adzuna.fr/details/5265164708?utm_medium=api&utm_source=df7b4409,,adzuna
5265154235,Lead data F/H,Le poste Vos missions ? En tant que Lead Data vous serez en charge des missions suivantes: - Accompagner et faire monter en compétence les membres de l'équipe Data - Définir la vision et la roadmap data de l'entreprsie - Compréhension du besoin client et être capable de le traduire aux équipes métier - Veiller à la cohérence et la qualité des données utilisées - Suivi de l'évolution des outils data - Développer des algorythmes et des modèles Machine Learning - Mettre en production des solutions…,2025-06-24T08:18:08Z,"Lille-Nord, Lille - France > Hauts-De-France > Nord > Lille > Lille-Nord",50.66138,3.0502,AMILTONE,https://www.adzuna.fr/details/5265154235?utm_medium=api&utm_source=df7b4409,CDI,adzuna
5265683414,Expert / Experte big data,"Solantis accompagne son client, un acteur majeur dans le domaine de l'énergie, engagé activement dans la transition vers des solutions durables et innovantes, dans la recherche d'un.e Expert.e Infrastructure & Big Data. Vous rejoindrez un service Big Data, une infrastructure mutualisée pour l'ensemble des applications du groupe, constituée de différents composants (Hadoop, Hive, Spark, ). Le service Big Data compte plus de 500 machines et est en pleine mutation, avec un enjeu fort de sûreté de …",2025-06-24T15:16:54Z,"Seine-Maritime, Normandie - France > Normandie > Seine-Maritime",49.629473,0.78306,Solantis,https://www.adzuna.fr/details/5265683414?utm_medium=api&utm_source=df7b4409,CDI,adzuna
5264762717,Consultant data (H/F),"Description de l'entreprise Mon client est une entreprise spécialisée dans l'intégration de solutions Microsoft et les services cloud associés. Fondée en 2012 et certifiée Microsoft Gold Partner, elle accompagne les entreprises dans leur transformation digitale à travers des solutions telles que les ERP, les CRM, les outils de dématérialisation, l'intelligence des données (BI), et les applications collaboratives comme Office 365. L'entreprise se distingue par son expertise en gestion de projets…",2025-06-24T01:17:16Z,"Strasbourg, Strasbourg-Ville - France > Grand-Est > Bas-Rhin > Strasbourg-Ville > Strasbourg",48.58293,7.74375,AD'Missions One - Arrouet,https://www.adzuna.fr/details/5264762717?utm_medium=api&utm_source=df7b4409,CDI,adzuna
5265164474,Data Engineer H/F,"À la recherche d'une opportunité ? Nous recherchons pour notre agence de Lille des profils Data Engineer pour intervenir chez nos clients grands comptes. Dans ce cadre, vous serez amené(e) à : * Concevoir et développer des pipelines de données robustes et performants, * Optimiser les systèmes de stockage et de traitement des données (bases SQL/NoSQL, solutions Big Data), * Mettre en oeuvre des solutions cloud (AWS, Azure, Google Cloud) pour gérer des environnements complexes, * Garantir la qual…",2025-06-24T08:27:06Z,"La-Madeleine, Lille - France > Hauts-De-France > Nord > Lille > La-Madeleine",50.63718,3.06302,Solutec,https://www.adzuna.fr/details/5265164474?utm_medium=api&utm_source=df7b4409,,adzuna
5265683485,Ingénieur / Ingénieure data scientist,"Capgemini en quelques mots Choisir Capgemini, c'est choisir une entreprise où vous serez en mesure de façonner votre carrière selon vos aspirations, où vous serez soutenu et inspiré par une communauté d’experts dans le monde entier, où vous pourrez réécrire votre futur. Rejoignez-nous pour redéfinir les limites de ce qui est possible, contribuer à libérer la valeur de la technologie pour les plus grandes organisations et participez à la construction d’un monde plus durable et inclusif. Vos miss…",2025-06-24T15:16:54Z,"Haute-Garonne, Occitanie - France > Occitanie > Haute-Garonne",43.4082,1.13894,Capgemini,https://www.adzuna.fr/details/5265683485?utm_medium=api&utm_source=df7b4409,CDI,adzuna
5265154187,Lead Data F/H,Le poste Vos missions ? En tant que Lead Data vous serez en charge des missions suivantes: - Accompagner et faire monter en compétence les membres de l'équipe Data - Définir la vision et la roadmap data de l'entreprsie - Compréhension du besoin client et être capable de le traduire aux équipes métier - Veiller à la cohérence et la qualité des données utilisées - Suivi de l'évolution des outils data - Développer des algorythmes et des modèles Machine Learning - Mettre en production des solutions…,2025-06-24T08:18:07Z,"Lyon, Rhône - France > Auvergne-Rhône-Alpes > Rhône > Lyon",45.72035,5.08666,AMILTONE,https://www.adzuna.fr/details/5265154187?utm_medium=api&utm_source=df7b4409,CDI,adzuna
5265156057,Consultant data F/H,"Description de l'entreprise Mon client est une entreprise spécialisée dans l'intégration de solutions Microsoft et les services cloud associés. Fondée en 2012 et certifiée Microsoft Gold Partner, elle accompagne les entreprises dans leur transformation digitale à travers des solutions telles que les ERP, les CRM, les outils de dématérialisation, l'intelligence des données (BI), et les applications collaboratives comme Office 365. L'entreprise se distingue par son expertise en gestion de projets…",2025-06-24T08:19:08Z,"Strasbourg, Strasbourg-Ville - France > Grand-Est > Bas-Rhin > Strasbourg-Ville > Strasbourg",48.58293,7.74375,AD'Missions One - Arrouet,https://www.adzuna.fr/details/5265156057?utm_medium=api&utm_source=df7b4409,CDI,adzuna
